"index","text_type","ID","date_created","year","long_text","clean_text","tokens","word_count"
"233","comment","ewm2xjg","2019-08-11 20:46:18","2019","Except for some of the specific details, this describes my feelings perfectly. I was forced to move ""back home"" to Goa because I couldn't find any permanent work. Having lived in the U.A.E. for 30 years, it's extremely difficult to adjust. 

I can't just walk a few blocks at 2 a.m. to get a burger. There are only a handful of supermarkets of any worth. We have to deal with monsoons, roaming cows and their waste, tons of stray dogs, and around 10,000 different species of arachnids and insects. There's the ""taxi mafia"", woeful customer service, rude shopkeepers who act like they're doing you a favor, and frequent power cuts that are just accepted as normal. Even though pork is more widely available, the bacon here sucks. 

I'm not saying Goa is a hell-hole, and there are some positives (such as cheaper internet), but when you're used to a certain lifestyle and have to completely leave it all behind for a less-developed place you have pretty much zero attachment to, it's jarring.","describe feeling perfectly force permanent having difficult adjust walk block burger handful supermarket deal roam cow waste ton stray dog specie insect taxi mafia customer service rude shopkeeper favor frequent power pork widely bacon hole positive cheap internet lifestyle developed zero attachment","['describe', 'feeling', 'perfectly', 'force', 'permanent', 'having', 'difficult', 'adjust', 'walk', 'block', 'burger', 'handful', 'supermarket', 'deal', 'roam', 'cow', 'waste', 'ton', 'stray', 'dog', 'specie', 'insect', 'taxi', 'mafia', 'customer', 'service', 'rude', 'shopkeeper', 'favor', 'frequent', 'power', 'pork', 'widely', 'bacon', 'hole', 'positive', 'cheap', 'internet', 'lifestyle', 'developed', 'zero', 'attachment']","42"
"267","comment","fb68ezr","2019-12-17 04:52:52","2019","It's so touching to see bromance develop between someone named FatFather1818 and surprisebuttseks","develop","['develop']","1"
"279","comment","ewm7kp0","2019-08-11 21:37:06","2019","*Most* Indians have degrees in computer science? What? Not even 10% of the adult Indian population are graduates of any kind, and I can't think of a single person I know who has any kind of computer degree.","indians degree computer science adult indian population graduate single computer degree","['indians', 'degree', 'computer', 'science', 'adult', 'indian', 'population', 'graduate', 'single', 'computer', 'degree']","11"
"755","comment","josli8t","2023-06-20 08:35:18","2023","Wow. That's very interesting to know.  Thanks for sharing your experience.","","[]","0"
"771","comment","josux9n","2023-06-20 10:28:16","2023","Currently it’s gonna cost around 70K per annum, you can check on Bayut or property finder","cost annum bayut property finder","['cost', 'annum', 'bayut', 'property', 'finder']","5"
"843","comment","hp9bkr2","2021-12-20 08:38:22","2021","It is happening already as it has in abu dhabi.

There are licensed restaurants not attached or associated with hotels popping up.  It is likely to be a positive move for the economy","license restaurant attach associate hotel pop positive economy","['license', 'restaurant', 'attach', 'associate', 'hotel', 'pop', 'positive', 'economy']","8"
"851","comment","hp7x3fl","2021-12-20 01:59:09","2021","That also reminded me similarly, if restaurants can fully offer a non-halal menu (I.e. pork) that would certainly be useful.","remind similarly restaurant fully offer halal menu pork certainly useful","['remind', 'similarly', 'restaurant', 'fully', 'offer', 'halal', 'menu', 'pork', 'certainly', 'useful']","10"
"980","comment","h9677i0","2021-08-16 20:07:09","2021","It was basically just a synthesis of typical news stories about Dubai. I wouldn't address the negatives. His justification for hating a city is its planning though? Then that's pretty much all US cities. Look at Los Angeles or Miami. And 21st century dystopia? Look at r/boring dystopia. People selling their blood to eat.  
       
He didn't point out any benefits. Namely: weather, modernity, safety, absence of taxes, opportunity, potential earning power, connectivity, travel opportunities (wow Americans can go to Mexico or Canada).     
    
And from the moralistic standpoint. First of all, probably at least 30% of things in a person's house were made by underpaid and mistreated employees in East Asia so that's pure hypocrisy. This is not justified but he better only use fairt rade electronics. Not to mention food and staples like coffee. Second, the UAE never invaded anyone. Third, it's a city where roughly 3.5million people decided to come to for a better life. It's the NYC of the Arab world and Middle East. Indians, Pakistanis, Bengalis, Filipinos, Russians, Western Europeans, Brits, Africans, Aussies, Chinese and so on have all come here. Without Dubai people would have settled for much less. He didn't address that. That pretty everyone came here and stayed here by choice.","typical address negative justification planning los angeles miami century boring sell blood eat benefit weather safety absence taxis opportunity potential earn power connectivity travel opportunity americans mexico canada standpoint house underpaid mistreat employee east asia pure hypocrisy justified electronic food staple coffee invade roughly nyc arab middle east indians pakistanis filipinos russians western europeans brit african aussie chinese settle address","['typical', 'address', 'negative', 'justification', 'planning', 'los', 'angeles', 'miami', 'century', 'boring', 'sell', 'blood', 'eat', 'benefit', 'weather', 'safety', 'absence', 'taxis', 'opportunity', 'potential', 'earn', 'power', 'connectivity', 'travel', 'opportunity', 'americans', 'mexico', 'canada', 'standpoint', 'house', 'underpaid', 'mistreat', 'employee', 'east', 'asia', 'pure', 'hypocrisy', 'justified', 'electronic', 'food', 'staple', 'coffee', 'invade', 'roughly', 'nyc', 'arab', 'middle', 'east', 'indians', 'pakistanis', 'filipinos', 'russians', 'western', 'europeans', 'brit', 'african', 'aussie', 'chinese', 'settle', 'address']","60"
"1339","comment","gett669","2020-12-06 17:36:00","2020","Does it come with 1 year warranty?","warranty","['warranty']","1"
"1503","comment","iwift5h","2022-11-16 01:36:10","2022","Alright, Kiddo. Peace.","peace","['peace']","1"
"1723","comment","gojzg9f","2021-02-24 09:55:14","2021","Dubai market has been spiraling downwards for the last 6 years. That leaves about 4 years of margin before panic strikes if RE pundits are to be believed. 

The markets which you follow, What are the long term trends they have been witnessing?","market spiral margin panic strike market term trend witness","['market', 'spiral', 'margin', 'panic', 'strike', 'market', 'term', 'trend', 'witness']","9"
"1792","comment","eacn4ao","2018-11-24 13:13:18","2018","I always say that this place has some magical and colorful sunsets. I know I will miss it one day.","magical sunset","['magical', 'sunset']","2"
"1797","comment","ead6jpi","2018-11-24 19:55:08","2018",">share  
>  
>save  
>  
>hide

dslr.. canon 550d with a 75-300mm lens :)) ","hide dslr canon lens","['hide', 'dslr', 'canon', 'lens']","4"
"2190","comment","gnidnw2","2021-02-15 10:26:14","2021","lulu not visible , not a clear shot","lulu visible","['lulu', 'visible']","2"
"2199","comment","d0zob8f","2016-03-14 23:15:08","2016","The generic I own burj Khalifa selfie ","generic burj khalifa selfie","['generic', 'burj', 'khalifa', 'selfie']","4"
"2730","comment","ge1cdxc","2020-11-29 18:38:17","2020","Looks like a charcoal drawing.","charcoal drawing","['charcoal', 'drawing']","2"
"2822","comment","gdpqkfn","2020-11-27 03:35:44","2020","Well to answer your main question, instead of slamming breaks - report them instead.","slam","['slam']","1"
"3156","comment","i38bnmd","2022-04-03 19:11:06","2022","Shifted away from Dubai in 2018, they changed the price for McDonald's ice cream?!?!?","shift price mcdonald ice cream","['shift', 'price', 'mcdonald', 'ice', 'cream']","5"
"3542","comment","f8bazkv","2019-11-22 18:19:09","2019","Just delete all the apps and never buy anything unless you need it and actually go look for it and compare prices 🤷🏽‍♀️","delete buy price","['delete', 'buy', 'price']","3"
"3601","comment","hqp8ix3","2021-12-31 21:03:24","2021","Well let's just hope he doesn't need a ventilator anytime soon","anytime","['anytime']","1"
"3621","comment","d1tecc6","2016-04-07 15:48:49","2016","Okay I'm so confused, why is samsamurai so popular???
","confused popular","['confused', 'popular']","2"
"3626","comment","d1t9jlc","2016-04-07 11:13:57","2016","i've never understood how you can tell it's someones cake day?","cake","['cake']","1"
"3651","comment","d1trl7l","2016-04-07 21:12:23","2016","So if I stop being confused, you'll stop being popular?","stop confuse stop popular","['stop', 'confuse', 'stop', 'popular']","4"
"3652","comment","d1tamv3","2016-04-07 12:15:55","2016","Let me try... porque no los dos?","los","['los']","1"
"3854","comment","joom7q3","2023-06-19 13:00:07","2023","Shawarma in almost every other country. Shawarma here isn't real shawarma, and it's not any good.

Go ahead and downvote this to oblivion, it won't change that it's true.","shawarma shawarma real shawarma oblivion","['shawarma', 'shawarma', 'real', 'shawarma', 'oblivion']","5"
"4566","comment","j1d0knn","2022-12-23 15:41:36","2022","Depression hit hard this year.","depression hit","['depression', 'hit']","2"
"4573","comment","j1cyhzh","2022-12-23 15:15:09","2022","Weather. It's still hot af.","weather hot","['weather', 'hot']","2"
"4596","comment","ipyqnhp","2022-09-26 16:53:13","2022","They have regular adoption days at various pet shops. Once you visit on adoption day and register yourself they will let you visit the shelter on volunteer days. The reason they don't give their location without getting to know you is because they have people regularly abandoning sick or old pets at their gates","regular adoption pet shop visit adoption register visit shelter volunteer location regularly sick pet gate","['regular', 'adoption', 'pet', 'shop', 'visit', 'adoption', 'register', 'visit', 'shelter', 'volunteer', 'location', 'regularly', 'sick', 'pet', 'gate']","15"
"4624","comment","dz8rxpq","2018-05-19 20:56:12","2018","Critical thinking can still be done with some semblance of respect.  A lot of that is lacking in many of the comments.

And some of the comments I did remove were straight out Islamophobic.","critical thinking respect lack straight islamophobic","['critical', 'thinking', 'respect', 'lack', 'straight', 'islamophobic']","6"
"4637","comment","g9h93mb","2020-10-21 01:44:25","2020","Oh, how I wish I was back here. Spent many summer and Christmas holidays at the Towers Rotana, a few doors down from the Four Points. 

Amazing picture and thanks for the happy memories. I had planned to visit Dubai in October but COVID stopped my plans.","spend summer christmas holiday tower door memory plan visit october covid stop plan","['spend', 'summer', 'christmas', 'holiday', 'tower', 'door', 'memory', 'plan', 'visit', 'october', 'covid', 'stop', 'plan']","13"
"5182","comment","fq9via5","2020-05-11 18:37:52","2020","Even when I see a GN link here, I try searching on Google for same news in The National or Khaleej Times. Actively avoiding Gulf News","national khaleej actively","['national', 'khaleej', 'actively']","3"
"5472","comment","jhnw7bq","2023-04-25 19:31:41","2023","It's a easy way to know if you're getting scammed actually. Works for me","scammed","['scammed']","1"
"5546","comment","jhsd2cz","2023-04-26 18:16:33","2023","I use “dear” when I need to be annoying to someone 😂😂","dear annoying","['dear', 'annoying']","2"
"5713","comment","jhp65o0","2023-04-26 00:27:05","2023","I get you but you’re just overthinking it. They don’t mean the same dear that you’re used to it’s just something they’re used to that they say without malicious intentions","overthinke dear malicious intention","['overthinke', 'dear', 'malicious', 'intention']","4"
"5845","comment","htishku","2022-01-21 02:55:27","2022","Nah that's like fat and dubious","nah fat","['nah', 'fat']","2"
"5951","comment","elhd3lk","2019-04-22 12:00:32","2019","The best food you've had there? How is the indie arts/cultural scene? =) And glad you're enjoying it so much!","food art cultural scene","['food', 'art', 'cultural', 'scene']","4"
"6046","comment","dhx8dvy","2017-05-23 12:12:15","2017","Agreed! 

I would also like to point out the incorrect use of the word ""immigrant"" in the article which are people who look to permanently settle in another nation to make it their new home. This is not the case in Dubai, where most of us expats eventually have to go back or have no intention to permanently settle here. ","incorrect immigrant permanently settle nation expat eventually intention permanently settle","['incorrect', 'immigrant', 'permanently', 'settle', 'nation', 'expat', 'eventually', 'intention', 'permanently', 'settle']","10"
"6047","comment","dhxa5s0","2017-05-23 13:40:24","2017",">Typical Apologist BS site. The name says it all

How does the name says it all? ","typical apologist site","['typical', 'apologist', 'site']","3"
"6049","comment","dhxuekx","2017-05-23 21:53:26","2017","It falsely suggests laws are applied fairly. Prosecutors in the UAE are daft and are not qualified to determine what constitutes consensual sex. ","falsely law apply fairly prosecutor daft qualified determine constitute consensual sex","['falsely', 'law', 'apply', 'fairly', 'prosecutor', 'daft', 'qualified', 'determine', 'constitute', 'consensual', 'sex']","11"
"6051","comment","dhxttdj","2017-05-23 21:42:31","2017","Your agenda is clearly to whitewash severe shortcomings  in the UAE justice system. 

Your pretend and deeply flawed ""analysis"" doesn't seem to be fooling many here. 

No, women being jailed after reporting rape is not some western cultural misunderstanding, it is a deep seated problem here locally and only a fraction of the victims are western women. The majority of victims are so powerless they cannot even voice their struggles.","agenda severe shortcoming justice pretend deeply flawed analysis fool jail rape western cultural misunderstanding deep seat locally fraction victim western majority victim voice struggle","['agenda', 'severe', 'shortcoming', 'justice', 'pretend', 'deeply', 'flawed', 'analysis', 'fool', 'jail', 'rape', 'western', 'cultural', 'misunderstanding', 'deep', 'seat', 'locally', 'fraction', 'victim', 'western', 'majority', 'victim', 'voice', 'struggle']","24"
"6085","comment","el1mpzk","2019-04-16 23:43:38","2019","He's being facetious....and don't share your personal email id on the public domain please. You can easily PM him.","email public domain","['email', 'public', 'domain']","3"
"6090","comment","el27tx4","2019-04-17 03:39:14","2019","No problem i bough a bugatti from it aswell cool to see its not maxed out 😁 hope you got the xs max","bugatti aswell cool max","['bugatti', 'aswell', 'cool', 'max']","4"
"6114","comment","eyyhpki","2019-09-04 13:05:29","2019","Me: KILLA QUEEN, BITE THE DUST","queen bite dust","['queen', 'bite', 'dust']","3"
"6132","comment","eyytvuo","2019-09-04 16:54:24","2019","I agree. I was surprised to see this too. I think Arabs are more tolerant compared to Filipinos.","surprised arab tolerant filipino","['surprised', 'arab', 'tolerant', 'filipino']","4"
"6149","comment","eyygufq","2019-09-04 12:42:38","2019","I think most of us americans (with the exception of US and Canada) can handle it","americans exception canada","['americans', 'exception', 'canada']","3"
"6442","comment","gzfg4ol","2021-05-25 23:40:54","2021","You need someone who knows cars, most issues are easy to check on your own. An obd scanner tool even one of those cheap ones to read error codes helps since you can look them up and there's always the internet for any obvious issues. 

Regarding garages, there's no way to be sure if they're cheating you or not. It's best if you know the owner personally imo, if you find a good one stick with them. 
If you don't mind paying higher some of the reputed ones  and dealerships are honest but they charge a fat premium for it. You can try Max Garage and Deutsche Auto Werks for just inspecting your vehicle.

You can also come to us for a second opinion if you feel like the prices are too high, we charge maybe 2/3rds of the price, most of the time lower.","scanner tool cheap error code internet obvious regard garage cheat dealership charge fat premium max garage auto inspect vehicle price charge price lower","['scanner', 'tool', 'cheap', 'error', 'code', 'internet', 'obvious', 'regard', 'garage', 'cheat', 'dealership', 'charge', 'fat', 'premium', 'max', 'garage', 'auto', 'inspect', 'vehicle', 'price', 'charge', 'price', 'lower']","23"
"6460","comment","gzecrf0","2021-05-25 19:01:23","2021","Nah, dont depend on the dubizzle verified stuff, its another way for bringing in more customers","nah dubizzle verify customer","['nah', 'dubizzle', 'verify', 'customer']","4"
"6862","comment","dzd8r7c","2018-05-22 06:47:00","2018","Newbie here. What sort of alternatives does Emirates NBD typically provide? Like 0% interest loans? ","newbie alternative nbd typically interest loan","['newbie', 'alternative', 'nbd', 'typically', 'interest', 'loan']","6"
"6895","comment","g45pjby","2020-09-05 23:49:08","2020","I prefer the days pre-meters, one dude in RAK asked for 3dhs from the station to Nakheel area, I shocked him saying I refuse to pay 3 I want to pay 5, he said things weren't argued that way.","pre meter rak station nakheel area shock refuse argue","['pre', 'meter', 'rak', 'station', 'nakheel', 'area', 'shock', 'refuse', 'argue']","9"
"7086","comment","jalyz9l","2023-03-02 15:26:29","2023","I remember Cyclone Club in next to Al Nasr Leisureland","club","['club']","1"
"7121","comment","g5gveu0","2020-09-16 17:22:45","2020","It does look really cool at night from inside the masjid","cool night inside masjid","['cool', 'night', 'inside', 'masjid']","4"
"7321","comment","fwk1k7x","2020-07-01 09:38:25","2020","Photos all over IG tbh 💀","","[]","0"
"7348","comment","fwi9kze","2020-06-30 23:29:45","2020","pantsu man... pantsu..","","[]","0"
"7514","comment","fup3cn1","2020-06-13 16:19:48","2020",">We pay with commitment and hard Labour under stressful environments

LOL","commitment labour stressful environment","['commitment', 'labour', 'stressful', 'environment']","4"
"7585","comment","fr9mhob","2020-05-20 22:41:20","2020","Dubai frame should be Karama","frame karama","['frame', 'karama']","2"
"7702","comment","hsr72p7","2022-01-15 15:44:17","2022",">sthings

Is this a new word for shit + things = sthings?

/s","","[]","0"
"7891","comment","hh9t3kx","2021-10-19 23:42:07","2021","OP thinks atheist = cool","atheist cool","['atheist', 'cool']","2"
"8100","comment","frmsmym","2020-05-24 13:00:36","2020",">I've honestly never felt so loved and worthy

And a bunch of other stuff in your comment.","worthy bunch","['worthy', 'bunch']","2"
"8163","comment","fsy7l3d","2020-06-05 11:19:15","2020","But this building is in Abu Dhabi. It was damaged during a sand storm and so they decided to dismantle the ball.","building damage sand storm ball","['building', 'damage', 'sand', 'storm', 'ball']","5"
"8215","comment","h94k0m3","2021-08-16 10:19:04","2021","Once a supermarket staff told me that I can keep it outside the room, they do a weekly check in my building, could one of those after sale service.","supermarket staff outside room weekly building sale service","['supermarket', 'staff', 'outside', 'room', 'weekly', 'building', 'sale', 'service']","8"
"8281","comment","h90kkqp","2021-08-15 14:14:01","2021","From your car to your apartment, it's more convenient to use a trolley provided by your building management. You return it to the common area for everyone's use when you're done.","apartment convenient trolley building management common area","['apartment', 'convenient', 'trolley', 'building', 'management', 'common', 'area']","7"
"8294","comment","h90mtw8","2021-08-15 14:46:15","2021","Nah! I think I'm ok. With the rather sedatory lifestyle we live in, I wouldn't want to really make it that easy for me. 

You really can't expect people to return empty trolleys if 'convenience' is what they are after, they will make it someone else's problem.","nah lifestyle trolley convenience","['nah', 'lifestyle', 'trolley', 'convenience']","4"
"8315","comment","e5f32s0","2018-09-05 08:49:09","2018","The point is tax residency.","tax residency","['tax', 'residency']","2"
"8332","comment","joa2yqh","2023-06-16 02:14:17","2023","It definitely feels like they try to at least get 1 fail off of you. I got the road test done on the first try (flawless, 0 minor mistakes even) but they failed me on the parking test once. The fail? The car moved like 5cm backwards on the ramp test, pointed out it's less than 30cm or whatever but he didn't wanna hear it. 

Imagine passing all the hard ones like parallel parking on the first try and they fail you on that bullshit hahaha","fail road test flawless minor fail parking test fail backwards ramp test pass parallel parking fail bullshit hahaha","['fail', 'road', 'test', 'flawless', 'minor', 'fail', 'parking', 'test', 'fail', 'backwards', 'ramp', 'test', 'pass', 'parallel', 'parking', 'fail', 'bullshit', 'hahaha']","18"
"8636","comment","ipbf9na","2022-09-21 15:24:21","2022","Literally full of people working like dogs for absolutely nothing. Many don't even have their basic political rights such as a passport","dog political passport","['dog', 'political', 'passport']","3"
"9038","comment","euog8mt","2019-07-24 08:08:43","2019","I did the same. Plus have been to some agencies. Same story. Some are genuinely trying to help. But the majority of them prefer holders of certain passport holders... If you know what I'm trying to tell.","agency genuinely majority holder passport holder","['agency', 'genuinely', 'majority', 'holder', 'passport', 'holder']","6"
"9300","comment","gvt349l","2021-04-25 15:15:51","2021","Wont change anything... If they put Engineer wth 10+ years of experience... Salary 3K.. only few nationalities will find that a lucrative offer","engineer wth salary nationality lucrative offer","['engineer', 'wth', 'salary', 'nationality', 'lucrative', 'offer']","6"
"9453","comment","gvy0yel","2021-04-26 20:20:30","2021","Lol... Am just suggesting you go read the line above that and follow that guideline, instead of looking at options.","line guideline","['line', 'guideline']","2"
"9626","comment","d097zee","2016-02-22 17:15:18","2016","Oi [resident r/Dubai hipster](https://www.reddit.com/u/cocoric), what choice are you making?","resident hipster","['resident', 'hipster']","2"
"9628","comment","d09jg13","2016-02-22 22:28:19","2016","I'm in.. I just got my new e-cig","cig","['cig']","1"
"9686","comment","jkrppiq","2023-05-19 17:29:04","2023","A deflecting attitude won't help your case. A new word for you to Google is ""Maipulation"". Have fun learning!","deflect attitude fun learning","['deflect', 'attitude', 'fun', 'learning']","4"
"9774","comment","fwkcoyn","2020-07-01 12:28:06","2020","It was the same call but they added ""pray in your homes"" at the end.  
  
E: If you live close to a masjid you might hear a second call, it tells people that the prayer is starting now.","pray masjid prayer","['pray', 'masjid', 'prayer']","3"
"9826","comment","jonw2r7","2023-06-19 07:30:26","2023","there is mosques in jumeriah area it have english qutuba if you are interested if a mosques has ladies pray area they can pray as well and many places now host eid prayers in some schools and eid ghahs , closer to eid days places with eid prayers and times will come out","mosque jumeriah area mosque lady pray area pray host eid prayer school eid eid eid prayer","['mosque', 'jumeriah', 'area', 'mosque', 'lady', 'pray', 'area', 'pray', 'host', 'eid', 'prayer', 'school', 'eid', 'eid', 'eid', 'prayer']","16"
"9841","comment","f3mr80v","2019-10-13 22:29:48","2019","the *777# is the best service out there","service","['service']","1"
"9984","comment","f6ol1xp","2019-11-06 10:33:47","2019","Now this is good. Bravo, OP!","bravo","['bravo']","1"
"9999","comment","f6oodbp","2019-11-06 11:46:32","2019","Looks amazing my man","","[]","0"
"10037","comment","hnhh1da","2021-12-06 21:55:50","2021","We have reached unprecedented levels of meta and I am so proud of you guys. Thank you for making r/dubai great again","meta proud","['meta', 'proud']","2"
"10136","comment","ebxc1ze","2018-12-16 23:02:06","2018","Man, this guy is trending. ","trend","['trend']","1"
"10146","comment","ebwoqqx","2018-12-16 17:15:09","2018","Masturbation in the internet age; strong hand on the mouse.","internet age mouse","['internet', 'age', 'mouse']","3"
"10166","comment","ebwt036","2018-12-16 18:41:17","2018","I think that being ridiculed by everyone on social media is already a nice punishement... He's lucky his name wasn't outed yet.","ridicule social lucky","['ridicule', 'social', 'lucky']","3"
"10173","comment","ebwvkxe","2018-12-16 19:25:22","2018","Cold have been a great joke right there. ","cold","['cold']","1"
"10180","comment","ec22n5m","2018-12-18 21:57:14","2018","C'mon man.","mon","['mon']","1"
"10409","comment","hu24c20","2022-01-24 23:33:52","2022","I am afraid we'll have to stick to the guesstimate for now. 😁

It's roughly 300 million in revenue for 3 million fill-ups. Not bad for a startup founded in 2018.","afraid roughly million revenue million startup found","['afraid', 'roughly', 'million', 'revenue', 'million', 'startup', 'found']","7"
"10664","comment","hjw21so","2021-11-09 07:08:01","2021","Thanks for caring enough to reply!","","[]","0"
