"index","text_type","ID","date_created","year","long_text","clean_text","tokens","word_count"
"36967","comment","d0kr0l8","2016-03-02 19:13:14","2016","Degrees only get you so far, experience is far more important after 2-3 years in the workplace.  

I don't care where someone is educated, I dropped out of university but still did pretty well in my career through hard work.
However I've interviewed some people with 2 degrees who could hardly answer a few basic questions when asked.

To me job based knowledge, work ethic, communication skills, general writing skills, critical thinking, initiative, ability to take constructive critiscm, ownership, English language skills are all really important for me and the companies I've worked for.

It's difficult to explain without sounding prejudiced but certain ways of working I've seen from individuals from certain countries are not really compatible with the corporate culture of some businesses. 

As an example, where I'm from it is considered acceptable to challenge your boss on why decisions are made,  to acknowledge mistakes and accept responsibility, to say no to work when you think it can't be done or don't have time.  With a lot of Indian colleagues I've worked with, they would say that those sorts of things would be unacceptable in their work culture.  

I hope you take that in the way it was meant.  Just that in my experience as a Westerner, it can be difficult trying to adapt to Indian workplace culture and I'm sure the same true in reverse.  Whether this is an issue or not depends on the individual and the business involved.   This may in turn affect peoples hiring decisions.","degree workplace educate university career interview degree hardly ethic communication skill writing skill critical thinking initiative constructive ownership language skill difficult explain prejudiced individual compatible corporate culture acceptable challenge boss decision acknowledge responsibility indian colleague unacceptable culture westerner difficult adapt indian workplace culture reverse individual turn hire decision","['degree', 'workplace', 'educate', 'university', 'career', 'interview', 'degree', 'hardly', 'ethic', 'communication', 'skill', 'writing', 'skill', 'critical', 'thinking', 'initiative', 'constructive', 'ownership', 'language', 'skill', 'difficult', 'explain', 'prejudiced', 'individual', 'compatible', 'corporate', 'culture', 'acceptable', 'challenge', 'boss', 'decision', 'acknowledge', 'responsibility', 'indian', 'colleague', 'unacceptable', 'culture', 'westerner', 'difficult', 'adapt', 'indian', 'workplace', 'culture', 'reverse', 'individual', 'turn', 'hire', 'decision']","48"
"37065","comment","jhtvqzb","2023-04-27 00:10:26","2023","Yes, people are idiots.","","[]","0"
"37175","comment","jhvwffp","2023-04-27 09:30:05","2023","I’d rather buy belle delphines bath water","buy bath water","['buy', 'bath', 'water']","3"
"37357","comment","hnljzz5","2021-12-07 18:49:17","2021","Have I got news for you about the Jews.","jews","['jews']","1"
"37358","comment","hnma8wb","2021-12-07 22:01:51","2021","Lets not give wrong explanations of the Quran out of context.

For that matter the new govt rule is no work after Friday prayer for govt , so that does not fit in with your analysis in any way","explanation quran context govt rule friday prayer govt fit analysis","['explanation', 'quran', 'context', 'govt', 'rule', 'friday', 'prayer', 'govt', 'fit', 'analysis']","10"
"37512","comment","f2uz5rd","2019-10-07 12:27:56","2019","There are many cities called Dubai in India.  Your friend was not wrong. 

Apparently the name Dobai comes from proto-hindi/urdu and was to call the city ""the two brothers"" as in the two banks of the creek.","india apparently hindi urdu bank creek","['india', 'apparently', 'hindi', 'urdu', 'bank', 'creek']","6"
"37539","comment","f2svdlf","2019-10-06 22:43:47","2019","Since when is buying oil on the free market considered theft? 

Also, had it not been for the American led coalition during the Gulf War, the GCC would be known as the other provinces of Iraq.

How’s that for a geography lesson?","buy oil market theft american war gcc province iraq geography lesson","['buy', 'oil', 'market', 'theft', 'american', 'war', 'gcc', 'province', 'iraq', 'geography', 'lesson']","11"
"37885","comment","hrbyyas","2022-01-05 12:54:31","2022","They said the guys r unhygienic and them getting their bottles to fill all the time was a cause of concern to hygiene. As i said earlier, im done with the company, would love to name and shame them just that the employees would suffer","unhygienic bottle concern hygiene shame employee suffer","['unhygienic', 'bottle', 'concern', 'hygiene', 'shame', 'employee', 'suffer']","7"
"37904","comment","hrc7vjj","2022-01-05 14:48:51","2022","Thank you for having a heart to forgive. God bless. 😊","heart forgive bless","['heart', 'forgive', 'bless']","3"
"37940","comment","hrbcrkj","2022-01-05 08:56:45","2022","They're certainly overworked, much like taxi drivers here. But just asking is a better tack. Everyone I know personally would happily give a delivery rider a water and some snacks. It also is a disservice to other riders to condone this imo.","certainly overwork taxi driver happily delivery rider water snack rider condone","['certainly', 'overwork', 'taxi', 'driver', 'happily', 'delivery', 'rider', 'water', 'snack', 'rider', 'condone']","11"
"38031","comment","hepzych","2021-09-29 17:47:22","2021","Communication between each other? That kinda defeats the purpose","communication defeat purpose","['communication', 'defeat', 'purpose']","3"
"38321","comment","ghooz95","2021-01-01 11:29:08","2021","The stars look beautiful man, great shot!","star","['star']","1"
"38489","comment","jhwkt7j","2023-04-27 15:03:23","2023","Congratulations! It’s a special feeling when the checker smiles and says you passed. I myself did it on 4th attempt and took 9 months including 3 month Covid lockdown. Safe driving!","special feeling smile pass attempt covid lockdown safe driving","['special', 'feeling', 'smile', 'pass', 'attempt', 'covid', 'lockdown', 'safe', 'driving']","9"
"38810","comment","jo7zp7e","2023-06-15 17:02:34","2023","I think op was being sarcastic, uber and careem have tesla as luxury sedan or something where as standard car and cheapest is the lexus and now tesla is a taxi which means it's the cheapest compared to those careem teslas but ofcource you can't specifically ask for tesla taxis when booking","sarcastic uber careem tesla luxury sedan standard cheap lexus tesla taxi cheap careem tesla specifically tesla taxi book","['sarcastic', 'uber', 'careem', 'tesla', 'luxury', 'sedan', 'standard', 'cheap', 'lexus', 'tesla', 'taxi', 'cheap', 'careem', 'tesla', 'specifically', 'tesla', 'taxi', 'book']","18"
"38819","comment","dr6fvpw","2017-12-13 11:16:49","2017","I ran in here thinking the UAE decided to stop their tax idea, misleading title yo.","stop tax mislead title","['stop', 'tax', 'mislead', 'title']","4"
"38824","comment","dr6jipu","2017-12-13 13:37:51","2017","No VAT levied on the Dubai subreddit! You go man! Fight the system, more power to you !","vat levy fight power","['vat', 'levy', 'fight', 'power']","4"
"38831","comment","dr8fz71","2017-12-14 14:54:48","2017","""if the supplier got 5% tax and the retailer got 5% so it means i paid 10% tax ? ""","supplier tax retailer tax","['supplier', 'tax', 'retailer', 'tax']","4"
"38848","comment","dr71xqq","2017-12-13 21:11:53","2017","I read this and it reminded me of James Hetfield for some reason.

https://youtu.be/Fd9ohpDDCRU?t=1m48s
","remind james","['remind', 'james']","2"
"39096","comment","hiqbvvx","2021-10-31 08:56:08","2021","In their contract it's said that you'll have to pay. That's what police mentioned when we complained.","contract police","['contract', 'police']","2"
"39752","comment","j2dq0yz","2022-12-31 18:27:49","2022","One opinion of a Imam Alghazali and likewise shared with ibn Taymiyyah (رحمة الله عليهم): 
> it has not happened because it was written it was written because it happened.

(this opinion could extrapolate to Allah (سبحانه وتعال) experiencing time as a whole but i may be wrong and this 'experience' is possibly not experience itself but a whole other thing beyond nature and understanding). 

A second opinion shared by the same scholars:
> it has not happened because it was written it was written because he knows it will happen.

(Extrapolates to Allah knows the future. He is omniscient.This opinion is of stronger basis)

Also concluded both of these opinion could hold true

And Allah knows best.","imam likewise ibn allah possibly nature scholar allah basis conclude allah","['imam', 'likewise', 'ibn', 'allah', 'possibly', 'nature', 'scholar', 'allah', 'basis', 'conclude', 'allah']","11"
"39798","comment","crk7low","2015-05-25 16:27:14","2015","haha buzzfeed india....not working for 99.999999% of this sub","buzzfeed india","['buzzfeed', 'india']","2"
"39799","comment","crkb22m","2015-05-25 19:00:17","2015","Quality shitpost. Even by Buzzfeed standards.","shitpost buzzfeed standard","['shitpost', 'buzzfeed', 'standard']","3"
"39800","comment","crk6gwv","2015-05-25 15:12:20","2015","Dubai...orderly....

What the hell kind of country did the author come from?!","orderly","['orderly']","1"
"39801","comment","crkqvtd","2015-05-26 03:15:47","2015","just moved here. do not relate. no mention of racial diversity + racism, drivers about to kill you, NO NAMES FOR ROADS, no PDA, a cab fare costing less than a shitty beer, massage cards, ""hello m'am,"" and endless malls filled with gaggles of dignified women wearing Death Eater cloaks, 1-inch false lashes, and Hermes handbags?


... come on Buzzfeed, I'm waiting for the shitpost that quotes this comment","racial diversity racism driver road pda cab fare cost shitty beer massage card endless mall death eater inch false lash handbag buzzfeed shitpost quote","['racial', 'diversity', 'racism', 'driver', 'road', 'pda', 'cab', 'fare', 'cost', 'shitty', 'beer', 'massage', 'card', 'endless', 'mall', 'death', 'eater', 'inch', 'false', 'lash', 'handbag', 'buzzfeed', 'shitpost', 'quote']","24"
"39803","comment","crl33lj","2015-05-26 10:05:54","2015","Umm..Incase you didn't get the memo, gifs are back bud!!!","umm incase memo bud","['umm', 'incase', 'memo', 'bud']","4"
"39805","comment","crk6u17","2015-05-25 15:38:06","2015","I'm from Lebanon, and believe me - Dubai is *hella* orderly compared to Beirut!","lebanon hella orderly beirut","['lebanon', 'hella', 'orderly', 'beirut']","4"
"39806","comment","crk7ti6","2015-05-25 16:39:38","2015","I have no idea man. There is absolutely NO INFORMATION on that website on where he could have come from.","website","['website']","1"
"39811","comment","crk6wlc","2015-05-25 15:43:01","2015","Oh yeah!? Well I threw out a McDonald's wrapper from my car window today! ANARCHY!","mcdonald window","['mcdonald', 'window']","2"
"39821","comment","e7r6fxu","2018-10-14 20:35:18","2018","Worlds best rush hour...seriously, move to Los Angeles, Chicago, or frigging Atlanta.  Then you can complain about rush hour.","rush los angeles chicago rush","['rush', 'los', 'angeles', 'chicago', 'rush']","5"
"39825","comment","e7so7po","2018-10-15 11:47:01","2018","How soon do you think this video will be on Lovin Dubai and KT/GN?","lovin","['lovin']","1"
"40057","comment","j5nssl3","2023-01-24 12:50:34","2023","Just beware that there is a 20km/h buffer outside of AD. So maybe you're driving under the normal speed limit and they want to overtake you and drive within the buffer speed.

This applies for the leftmost lane where you should move over. Otherwise ignore if you're not on the leftmost lane and want to drive slower. They can just overtake you from the left.","beware buffer outside drive speed limit overtake drive buffer speed apply leftmost lane leftmost lane drive overtake left","['beware', 'buffer', 'outside', 'drive', 'speed', 'limit', 'overtake', 'drive', 'buffer', 'speed', 'apply', 'leftmost', 'lane', 'leftmost', 'lane', 'drive', 'overtake', 'left']","18"
"40079","comment","j5o68sn","2023-01-24 15:53:37","2023","I do. Try you best to stay as far right as possible and only move left to overtake. Slow down when merging right and speed up when merging left. It's so simple it's actually astounding and scary that people don't understand it","overtake merge speed merge scary","['overtake', 'merge', 'speed', 'merge', 'scary']","5"
"40328","comment","hjjhl9r","2021-11-06 16:05:13","2021","Purely just my opinion - brokers/landlords trying to artificially drive up the demand by hiking the prices. And someone who has FOMO could very well get into the idea of not missing out, see the upward trend and try and get in to the real estate market now. Especially who are in here for expo, and could very much well be interested in living in Dubai/UAE because of the response to Covid here.

But on the other hand, what after expo? I don't think there will be any other reason or directive to keep increasing the rental prices or even the property prices. Once the extra people leave - all those who are employed at expo/just visiting expo and then when the tourist season is also over. What after that? Most likely we will see late 2020s prices again or even lower.

Obviously, if someone has a better perspective, I am all ears.","purely broker landlord artificially drive demand hike price trend real estate market expo covid expo rental price property price employ expo visit expo tourist season late price perspective ear","['purely', 'broker', 'landlord', 'artificially', 'drive', 'demand', 'hike', 'price', 'trend', 'real', 'estate', 'market', 'expo', 'covid', 'expo', 'rental', 'price', 'property', 'price', 'employ', 'expo', 'visit', 'expo', 'tourist', 'season', 'late', 'price', 'perspective', 'ear']","29"
"40411","comment","h1jbv01","2021-06-12 21:46:22","2021","There are medical leaders who have lied. Dr. fauci for instance.

Hope by drawing attention to this doesn't automatically label anyone an anti-vaxxer.","medical leader fauci instance draw attention automatically label anti vaxxer","['medical', 'leader', 'fauci', 'instance', 'draw', 'attention', 'automatically', 'label', 'anti', 'vaxxer']","10"
"40765","comment","gwsc9h3","2021-05-03 18:32:27","2021","That probably applies to 80% of those in a Deira mosque. Not many speak Arabic there.","apply deira mosque arabic","['apply', 'deira', 'mosque', 'arabic']","4"
"40836","comment","dyb7dio","2018-05-02 09:42:19","2018","You know what I love even more?

People who insist on trying to get onto the train (exactly where the doors part instead of waiting on the periph where RTA added signage) before people even get a chance to detrain. This is even at stops like Damac or [enter mall stop here].

I don't feel bad about walking solidly through them, despite their yelps of protest.","insist train door rta signage stop damac mall stop walk despite protest","['insist', 'train', 'door', 'rta', 'signage', 'stop', 'damac', 'mall', 'stop', 'walk', 'despite', 'protest']","12"
"40840","comment","dyb4y6c","2018-05-02 08:43:39","2018","Adding to this, RTA should impose fine for improper queueing. I had to go Gold just for these stupid people","rta impose fine","['rta', 'impose', 'fine']","3"
"40842","comment","dybd967","2018-05-02 13:09:23","2018","What about people who block others path in the metro elevators","block path metro elevator","['block', 'path', 'metro', 'elevator']","4"
"40852","comment","dybcltm","2018-05-02 12:42:00","2018","This.  

Or they stop in the way of everyone to mess with their phone and/or look around lost.","stop mess","['stop', 'mess']","2"
"40854","comment","dybd78f","2018-05-02 13:07:12","2018","Y'know, as long as you're not going to work or trying to make a connection or anything, it's worth it to just skip a couple trains.

I'll gladly hang around in a large open area with air conditioning for a few extra minutes if it means that the train I get onto isn't a sardine-can.","connection skip couple train gladly hang large area air conditioning train","['connection', 'skip', 'couple', 'train', 'gladly', 'hang', 'large', 'area', 'air', 'conditioning', 'train']","11"
"40869","comment","dyd8szk","2018-05-03 09:18:27","2018","Kid running in halls and running to the train station both have their reasons. you really are a moron are you? you must be so fun at parties..","hall train station moron fun party","['hall', 'train', 'station', 'moron', 'fun', 'party']","6"
"40877","comment","ce3thw8","2013-12-17 17:11:12","2013","This thread is giving the Swedish flag a bad rep. ","swedish flag rep","['swedish', 'flag', 'rep']","3"
"40879","comment","ce3q9if","2013-12-17 11:45:36","2013","Mate, 7 games at 100 each is 700 AED and you are offering them *all* for 1000? If you are selling them all for 1000 that works out at 143 AED each. 

I hope you don't work in sales.

","game offer sell aed sale","['game', 'offer', 'sell', 'aed', 'sale']","5"
"40880","comment","ce3whl9","2013-12-17 19:52:47","2013","Consider this your punishment for trollbaiting","punishment","['punishment']","1"
"40884","comment","ce3tz30","2013-12-17 17:46:03","2013","I realize how stupid this is now but when I put the games up on Dubizzle I was tired and also went full retard which didn't help and I was bored as all hell in english when I was justifying the horrible math. Not a good combination :P","game dubizzle tired retard bored justify horrible math combination","['game', 'dubizzle', 'tired', 'retard', 'bored', 'justify', 'horrible', 'math', 'combination']","9"
"40887","comment","ce3ql4i","2013-12-17 12:10:59","2013","From his replies in this thread, I don't think he is *that* smart. ","smart","['smart']","1"
"40888","comment","ce3qncn","2013-12-17 12:15:59","2013","wait, so you're telling me it's not a good deal?","deal","['deal']","1"
"40890","comment","ce42hd0","2013-12-17 23:37:46","2013","Don't worry about it bro, i know this feels. ","","[]","0"
"40893","comment","ce3r70b","2013-12-17 13:06:09","2013","Answering that would not exactly help my case here.","","[]","0"
"40897","comment","ce3rjp8","2013-12-17 13:42:25","2013","no, just really bored in English/tired.","bored tired","['bored', 'tired']","2"
"40900","comment","ce3pcsj","2013-12-17 10:44:30","2013","2200AED is the highest I can offer.","offer","['offer']","1"
"40901","comment","cebu5v3","2013-12-28 17:12:08","2013","7x100 = 700 , not 1700. 

Although I'm not sure if you're trolling. ","troll","['troll']","1"
"40903","comment","ce3qmg5","2013-12-17 12:13:59","2013","lol... the trolls or even bigger math fail after you tried pointing it out!","troll math fail","['troll', 'math', 'fail']","3"
"40904","comment","ce3qwtu","2013-12-17 12:38:57","2013","Yeaahh, not smoking anything, just went full retard a few times.","smoke retard","['smoke', 'retard']","2"
"40905","comment","ce3qwd3","2013-12-17 12:37:45","2013","I may or may not have realised that I went full retard. Prices will be changed :P","realise retard price","['realise', 'retard', 'price']","3"
"40906","comment","ce3pdft","2013-12-17 10:45:34","2013","2,200AED for what? Both the PS3 and 360 games?","game","['game']","1"
"40908","comment","ce3phcg","2013-12-17 10:52:15","2013","I would take all of the 7 xbox games from you for 800AED, Final offer.

Deal??","xbox game final offer deal","['xbox', 'game', 'final', 'offer', 'deal']","5"
"40948","comment","he7uuls","2021-09-25 17:13:48","2021","thx for the information! that helps a lot. :)","","[]","0"
"40963","comment","gfu7h0e","2020-12-14 22:58:23","2020","Helping an clueless expat with ripped Carrefour paper bags and ton of stuff everywhere on ground, as in my case.","clueless expat rip carrefour paper bag ton ground","['clueless', 'expat', 'rip', 'carrefour', 'paper', 'bag', 'ton', 'ground']","8"
"40989","comment","gfv2bv0","2020-12-15 03:06:23","2020","Or maybe....watching out for the clueless expat.","clueless expat","['clueless', 'expat']","2"
"41099","comment","hxez0n3","2022-02-18 10:21:03","2022","Well you're a regular Ray of sunshine..","regular ray sunshine","['regular', 'ray', 'sunshine']","3"
"41317","comment","jfx5dmq","2023-04-12 07:37:53","2023","""commuted"" means reducing the sentence. In this case, she served no time due to the commuting of her sentence from fines + jail time to only fines.","sentence serve sentence fine jail fine","['sentence', 'serve', 'sentence', 'fine', 'jail', 'fine']","6"
"41325","comment","jfsgj4k","2023-04-11 08:32:06","2023",">I wish these kind of cases gets some media coverage

Totally.","coverage","['coverage']","1"
"41451","comment","jftmwg1","2023-04-11 17:09:09","2023","Are you for real? Lmao
I don’t want to engage in this conversation anymore. Feels like talking to a wall or something. 
Good day.","real engage conversation wall","['real', 'engage', 'conversation', 'wall']","4"
"41647","comment","jmrbp64","2023-06-03 20:37:52","2023","This is one of the reasons why I love this country.","","[]","0"
"41674","comment","fs77xn7","2020-05-29 17:57:24","2020","Very well thought out and written on the right subjects. Most of my friends went to Canada for universities and yes most of them agree that its not a walk in the park","subject canada university walk park","['subject', 'canada', 'university', 'walk', 'park']","5"
"41728","comment","fs7cvl4","2020-05-29 18:41:18","2020","And then there are parasites who get a fee to find someone to trap into a Canadian Visa.","fee trap canadian visa","['fee', 'trap', 'canadian', 'visa']","4"
"41885","comment","f23g602","2019-10-01 13:42:28","2019","The price point.
Convenience (with drive Thru and delivery)
Outlets are sparkly clean (unlike in other countries)
And ice cream for Aed 1! Yaaaas","price convenience drive delivery outlet clean unlike ice cream","['price', 'convenience', 'drive', 'delivery', 'outlet', 'clean', 'unlike', 'ice', 'cream']","9"
"42004","comment","h8ndlno","2021-08-12 16:54:12","2021","Do you eat at home or mostly eat out?","eat eat","['eat', 'eat']","2"
"42395","comment","fs6jct7","2020-05-29 12:32:28","2020","Karak Enthusiast

Make it brown or cream-ish white :)","karak enthusiast brown cream ish","['karak', 'enthusiast', 'brown', 'cream', 'ish']","5"
"42415","comment","fs6q0my","2020-05-29 14:19:20","2020","Abu Dhabi represent

Red background

White text

Happy 1000 subs!! 🥳","represent red background text","['represent', 'red', 'background', 'text']","4"
"42671","comment","fs74h75","2020-05-29 17:24:41","2020","Ya Habibi, shu fi? Mafi maaloom haza batrol???","habibi mafi batrol","['habibi', 'mafi', 'batrol']","3"
"42789","comment","gohccf6","2021-02-23 21:17:59","2021","Any specific reason for choosing Sinopharm.","sinopharm","['sinopharm']","1"
"42914","comment","erv9twp","2019-06-23 21:16:50","2019","He would make an amazing Bond villain.","bond villain","['bond', 'villain']","2"
"42924","comment","erubtnj","2019-06-23 10:28:46","2019","Everyone looks good in top hat and tails","hat tail","['hat', 'tail']","2"
"42928","comment","erupc9j","2019-06-23 16:16:13","2019","What? I saw these pics on H.H.MBR's Instagram story and thought he looked really cool. This is the first time I saw him dressed that way and thought I'd share it here.","mbr cool dress","['mbr', 'cool', 'dress']","3"
"42938","comment","eruj81b","2019-06-23 13:44:56","2019","The lord knows many things.","lord","['lord']","1"
"43000","comment","gmxtnw3","2021-02-11 18:15:02","2021","Hahahahaha literally the trigger point 🤷🏻‍♂️","hahahahaha trigger","['hahahahaha', 'trigger']","2"
"43184","comment","f3d6qew","2019-10-12 02:23:15","2019","Could've added something relating to Du or Etisalat 🤔","etisalat","['etisalat']","1"
"43233","comment","f9k9nql","2019-12-03 21:57:15","2019","pour neat onto armpits. let it soak for a couple of hours then in the wash.
I wear vests, v-neck with sleeves to help.","pour neat armpit soak couple wash vest neck sleeve","['pour', 'neat', 'armpit', 'soak', 'couple', 'wash', 'vest', 'neck', 'sleeve']","9"
"43369","comment","j2d94s1","2022-12-31 15:28:18","2022","Nakheel to security : YOU WERE NOT SUPPOSED TO CONVEY THE EXACT WORDS! 😭","nakheel security convey","['nakheel', 'security', 'convey']","3"
"43416","comment","j2damci","2022-12-31 15:48:07","2022","Guys can we actually do this? OP if you don't wanna spend aed100 then please start a givesendgo/gofundme","spend","['spend']","1"
"43603","comment","im9pyo4","2022-08-29 19:54:20","2022","us and lived in south america as well.  I would not have expected such a drastic difference just based on personal experience with drivers here and there.","south america drastic driver","['south', 'america', 'drastic', 'driver']","4"
"43736","comment","gqco240","2021-03-09 21:33:53","2021","Sole establishments put you at risk for your company’s transactions (which is why most opt for limited liability). You need to have good wasta if you’re going the SE route.","sole establishment risk companys transaction opt limited liability wasta route","['sole', 'establishment', 'risk', 'companys', 'transaction', 'opt', 'limited', 'liability', 'wasta', 'route']","10"
"43798","comment","ez8vy0b","2019-09-06 13:36:53","2019","Underground parking on Rashid boulevard. Always there is space. 5 min walk to the mall","underground parking rashid boulevard space min walk mall","['underground', 'parking', 'rashid', 'boulevard', 'space', 'min', 'walk', 'mall']","8"
"43809","comment","ezexrs3","2019-09-07 19:29:58","2019","is it an indoor walk or an outdoor walk","indoor walk outdoor walk","['indoor', 'walk', 'outdoor', 'walk']","4"
"43861","comment","gcfairm","2020-11-16 00:52:23","2020","I would like to know ur setup...","setup","['setup']","1"
"44004","comment","fr4tlsr","2020-05-19 17:56:59","2020","Its legit , I just called and they helped with my insomnia past week I'm facing.","legit past","['legit', 'past']","2"
