"index","text_type","ID","date_created","year","long_text","clean_text","tokens","word_count"
"95525","comment","evse199","2019-08-02 14:44:07","2019","Has anyone been near the Jebel Ali Palm recently? Is it just getting left to fall back to the sea like the World Islands?","jebel ali palm fall sea island","['jebel', 'ali', 'palm', 'fall', 'sea', 'island']","6"
"95548","comment","evspnfg","2019-08-02 17:40:46","2019","You're not allowed to drive there and as far as I know you can't go there by boat either.","drive boat","['drive', 'boat']","2"
"95942","comment","j2y7z0h","2023-01-04 23:54:37","2023","There's a similar thread on the front page today and one of the top comments said something like 'yeah you know Dubai got a lot of hate recently for the world cup'","cup","['cup']","1"
"96138","comment","j2vaeao","2023-01-04 08:35:18","2023","Perhaps because if the US was lenient, everyone and their mom would move here - from like most places in the world?! This was exactly the premise of my first comment on this entire post.","lenient mom premise","['lenient', 'mom', 'premise']","3"
"96154","comment","j2vk6kk","2023-01-04 10:07:34","2023","So making it difficult is a good thing?","difficult","['difficult']","1"
"96159","comment","j2vlqdn","2023-01-04 10:24:09","2023","Yes, we are making the same point. That guy trying to even compare low wage workers in any industry is completely off.","wage worker industry","['wage', 'worker', 'industry']","3"
"96539","comment","h2qby6x","2021-06-23 07:49:11","2021","Thanks for sharing. And the final job you landed was via LinkedIn or Indeed? Congratulations in any case, you deserve the best.","final land linkedin","['final', 'land', 'linkedin']","3"
"96563","comment","hnb4whq","2021-12-05 14:08:17","2021","good one to use in court..","court","['court']","1"
"96890","comment","dbdjae7","2016-12-19 13:32:40","2016","just give way when safe to do so. then memorize their car plates.  check how much fines the idiot has and enjoy the rest of your day.","safe plate fine rest","['safe', 'plate', 'fine', 'rest']","4"
"96895","comment","dbewjkw","2016-12-20 10:04:14","2016","You have 6 lanes. If you want to drive slow, stay out of the 2 left most lanes.","lane drive left lane","['lane', 'drive', 'left', 'lane']","4"
"96899","comment","dbdkmqk","2016-12-19 14:48:45","2016","The discussion reminds me of the following rhetoric/mindset: She doesn't not wear decent clothes, then she deserves to be raped! ","remind following rhetoric mindset clothe rape","['remind', 'following', 'rhetoric', 'mindset', 'clothe', 'rape']","6"
"96903","comment","dbdkv5h","2016-12-19 15:01:44","2016","> just because you're driving on the speed limit doesn't mean you get to hold the left lane.

You are talking about lane discipline. That's a different topic. 

Tailgating is not acceptable in any circumstance. ","drive speed limit left lane lane discipline topic tailgating acceptable circumstance","['drive', 'speed', 'limit', 'left', 'lane', 'lane', 'discipline', 'topic', 'tailgating', 'acceptable', 'circumstance']","11"
"96909","comment","dbdk7li","2016-12-19 14:25:11","2016","His name is Khalid... Khalid Stalker","khalid khalid stalker","['khalid', 'khalid', 'stalker']","3"
"96915","comment","dbdi3kf","2016-12-19 12:29:21","2016","So riding above speed limit is ok
Driving like a maniac is ok
Trying to kill with tailgate manevour is ok..
AND...
Riding within speed limit is not ok.. u call that hogging the road?
Wat a joke...
If everyone goes by 140 kmh in  mohd bin zayed road fast lane.. there is no reason to tailgate.. ","ride speed limit drive maniac tailgate ride speed limit hog road bin zaye road fast lane tailgate","['ride', 'speed', 'limit', 'drive', 'maniac', 'tailgate', 'ride', 'speed', 'limit', 'hog', 'road', 'bin', 'zaye', 'road', 'fast', 'lane', 'tailgate']","17"
"96921","comment","dbdjiyi","2016-12-19 13:45:49","2016","Bro, the left lane isn't a driving lane. It's an overtake lane. You take this lane to overtake people.

If you have people using the left lane to drive 80 in a 100 road, that creates traffic. Don't act as if the people who ""get tailgated"" are at no fault.","left lane driving lane overtake lane lane overtake left lane drive road traffic tailgate fault","['left', 'lane', 'driving', 'lane', 'overtake', 'lane', 'lane', 'overtake', 'left', 'lane', 'drive', 'road', 'traffic', 'tailgate', 'fault']","15"
"96927","comment","dbdk50t","2016-12-19 14:20:57","2016","It's not a driving lane, hello, stupid mentality to think that you're driving the speed limit so you sit in the lane.

It is for overtaking. It really is a third-world mentality that ""I'm doing speed limit I drive in fast lane"".

","driving lane mentality drive speed limit lane overtake mentality speed limit drive fast lane","['driving', 'lane', 'mentality', 'drive', 'speed', 'limit', 'lane', 'overtake', 'mentality', 'speed', 'limit', 'drive', 'fast', 'lane']","14"
"96930","comment","dbdz9my","2016-12-19 21:57:22","2016","Safety distance is the distance required to be behind the car without hitting him even if he fully stops. You rear end someone it will always be ur fault because u didnt maintain safety distance","safety distance distance hit fully stop rear fault maintain safety distance","['safety', 'distance', 'distance', 'hit', 'fully', 'stop', 'rear', 'fault', 'maintain', 'safety', 'distance']","11"
"97109","comment","fy3m5ms","2020-07-15 05:36:47","2020","Great shot, OP! My favorite running spot :) I usually run up and over the bridge sometimes. 

>Just type in ""Al Boom Tourist village"" on Google maps.

Or even the other side where Dubai Festival City is. Type in ""Marsa Plaza""","favorite running spot bridge boom tourist village map festival plaza","['favorite', 'running', 'spot', 'bridge', 'boom', 'tourist', 'village', 'map', 'festival', 'plaza']","10"
"97542","comment","gs11liw","2021-03-24 12:57:59","2021","I’m fine thank you. Fully recovered now. Took around 48 hours before I felt normal again. As I wasn’t expecting the side affects, I just hoped my comment would raise awareness of the side affects so if someone suffers, they know people also had similar sides that they are nothing to be overly concerned about. 

Congratulations on your first shot. I hope your second shot doesn’t come with the side affects.","fine fully recover raise awareness suffer overly concerned","['fine', 'fully', 'recover', 'raise', 'awareness', 'suffer', 'overly', 'concerned']","8"
"97754","comment","jkapg23","2023-05-16 03:05:14","2023","Abu Dhabi is still mostly like those days. I lost a debit card in a Baskin Robbins the other day and it was safe half an hour later.","debit card safe","['debit', 'card', 'safe']","3"
"97782","comment","jk8o5y7","2023-05-15 18:15:01","2023","Compared to the rest of the world it is still incredibly safe","rest incredibly safe","['rest', 'incredibly', 'safe']","3"
"97788","comment","jk9cjdk","2023-05-15 21:33:17","2023","Europe is big, so maybe do not generalize","europe generalize","['europe', 'generalize']","2"
"98207","comment","fsrobhx","2020-06-03 21:38:42","2020","I'm the Western expats who makes a tantrum when the restaurant refuses to serve local water.","western expat tantrum restaurant refuse serve local water","['western', 'expat', 'tantrum', 'restaurant', 'refuse', 'serve', 'local', 'water']","8"
"98270","comment","iif0yye","2022-07-31 23:19:58","2022","They don’t give a shit about you, that’s why.
They just care about the quickest and (sl)eaziest ways to maximize profits.","quick maximize profit","['quick', 'maximize', 'profit']","3"
"98314","comment","iie16oa","2022-07-31 19:08:02","2022","""Why can't I use a dishwasher in a desert country with extremely limited groundwater resources!!!'","dishwasher desert limited resource","['dishwasher', 'desert', 'limited', 'resource']","4"
"98461","comment","gou6ore","2021-02-26 19:32:44","2021","They do not have any.

Separate elevators are also humiliating! Unless it is being used to move furniture for example.","separate elevator furniture","['separate', 'elevator', 'furniture']","3"
"98520","comment","f948cum","2019-11-30 06:19:57","2019","Sorry, my bad. The last time I saw this pic was in “I grow up in Dubai” facebook group.","facebook","['facebook']","1"
"98534","comment","f96cdvx","2019-11-30 23:41:42","2019","Exactly. It's cheaper than a movie ticket, a full day affair if you want it to be and there's something for everyone. 

I know. I just can't help call it out when I see it. Call it my OCD.","cheap movie ticket affair","['cheap', 'movie', 'ticket', 'affair']","4"
"98713","comment","g8zb7l1","2020-10-16 10:55:17","2020","Fair enough. They do be having some good leather stuff in Pakistan section of GV.","fair leather pakistan section","['fair', 'leather', 'pakistan', 'section']","4"
"98827","comment","ib8sz7e","2022-06-05 16:01:42","2022",">He has been living in Dubai for some years on expired visa

Your brother must have very hefty fines pending due to overstay, or more worse if the company has filed for abscond on him. You need to clear them both inorder to leave the country. Otherwise, he gets jailed and deported along with a lifetime ban to enter UAE.

It is a much worse situation if he was on a Visit Visa!","expire visa hefty fine pende overstay file abscond gets jail deport lifetime ban visit visa","['expire', 'visa', 'hefty', 'fine', 'pende', 'overstay', 'file', 'abscond', 'gets', 'jail', 'deport', 'lifetime', 'ban', 'visit', 'visa']","15"
"99570","comment","g3mmv2k","2020-09-01 23:15:02","2020","Is this what we have come to ? GN reporting on an Instagram Story posted by a model/actress ... thwt too with so little research done that he got the intent and person wrong.","model research intent","['model', 'research', 'intent']","3"
"99832","comment","ikp0zhx","2022-08-17 23:09:42","2022","Camel milk smells like actual camels. Would not recommend.","camel milk smell camel","['camel', 'milk', 'smell', 'camel']","4"
"99917","comment","h4gxqhn","2021-07-08 17:17:45","2021","In Middle East.. No winter, only High and Low summer","middle east winter summer","['middle', 'east', 'winter', 'summer']","4"
"100043","comment","ic7nihv","2022-06-13 19:16:33","2022","“Think backwards” due to something that’s unnatural 💀 okay buddy","backwards","['backwards']","1"
"100629","comment","i8fozcn","2022-05-13 14:44:57","2022","Inna lilahi wa Inna ilayhi rajioon, it feels like the end of an era. May Allah put his soul at rest and  ease the coming weeks for his family

Does anyone know how this will affect universities? I have a final exam tomorrow.","inna inna ilayhi rajioon era allah soul rest ease family university final exam","['inna', 'inna', 'ilayhi', 'rajioon', 'era', 'allah', 'soul', 'rest', 'ease', 'family', 'university', 'final', 'exam']","13"
"100842","comment","h56uelp","2021-07-14 23:36:15","2021","Lmao it’s supposed to be saj.","","[]","0"
"100979","comment","joxukmt","2023-06-21 13:11:08","2023","maybe he mean pare? dunno but thank you for this. will definitely share it to my travel buddy my wife and hopefully can travel there soon","travel wife travel","['travel', 'wife', 'travel']","3"
"101122","comment","fmfoq4u","2020-04-05 00:21:32","2020","Yes, contacted my credit card company. They will file a dispute but I need proof that they had a policy in place on March 21st (I read it on their website) of full refund. Sadly I didn't do a screenshot 😞","credit card file dispute policy march website refund sadly screenshot","['credit', 'card', 'file', 'dispute', 'policy', 'march', 'website', 'refund', 'sadly', 'screenshot']","10"
"101151","comment","dsr0d50","2018-01-16 08:35:56","2018","*nervously waits for Reddit to get banned* ","ban","['ban']","1"
"101159","comment","dsrp8bo","2018-01-16 20:24:33","2018","I've been using whatsapp video calls without issues. 😐","","[]","0"
"101174","comment","dsr7gpv","2018-01-16 11:57:10","2018","Nope. But then again, Du is just Etisalat wearing a different hat. ","nope etisalat hat","['nope', 'etisalat', 'hat']","3"
"101205","comment","dsrjhpc","2018-01-16 18:39:28","2018","What are you on about? 

Etisalat is a semi government company, as is Du. So they control the content. Hense Du also blocking Skype, which was the topic at hand. 

Yes, they are publicly traded, so are Emirates and Etihad airways. Why would they not be? The government still has a say in how these business are operated, and that is to the benefit of the country, its culture and the business itself.

Then you bring up the fact that Etisalat operated in 16 countries, which only makes the topic more obvious. You think Etisalat is filtering the content in countries other than here? No, and then ask yourself why.

The fact that you even mention the BBC (A government funded company) and trying to say anyone is comparing them to a private company like Chanel 4 just shows how badly you are grasping any understanding of a basic comment like ""Du is just Etisalat wearing a different hat""

You can read, copy and paste from wiki; well done. 

","etisalat semi government control block skype topic publicly trade etihad airway government operate benefit culture etisalat operate topic obvious etisalat filter bbc government fund private badly grasp understanding etisalat hat copy paste","['etisalat', 'semi', 'government', 'control', 'block', 'skype', 'topic', 'publicly', 'trade', 'etihad', 'airway', 'government', 'operate', 'benefit', 'culture', 'etisalat', 'operate', 'topic', 'obvious', 'etisalat', 'filter', 'bbc', 'government', 'fund', 'private', 'badly', 'grasp', 'understanding', 'etisalat', 'hat', 'copy', 'paste']","32"
"101275","comment","ga13oo4","2020-10-25 12:31:07","2020","By the way, I just noticed that Dubai Duty Free offers home delivery... The perfume I wanted to buy on [Faces.com](https://Faces.com) is AED 100 cheaper on Dubai Duty Free, which applies automatic 5% discount on beauty items. It seems that orders below AED 1500 gets 5% discount, AED 1500+ gets 10% and above AED 2500+ it shows me 15% discount.","duty offer delivery perfume buy com cheap duty apply automatic discount beauty item order aed discount aed aed discount","['duty', 'offer', 'delivery', 'perfume', 'buy', 'com', 'cheap', 'duty', 'apply', 'automatic', 'discount', 'beauty', 'item', 'order', 'aed', 'discount', 'aed', 'aed', 'discount']","19"
"102197","comment","igkem8o","2022-07-18 01:37:45","2022","Hey! Thank you!! Sorry for the late response but do you by any chance know how can I get in touch with them?","late","['late']","1"
"102413","comment","d57oc0w","2016-07-11 13:21:58","2016","One guy called ""Bentley"" already signed up. Beautiful.","bentley sign","['bentley', 'sign']","2"
"102414","comment","d588omg","2016-07-11 23:21:25","2016","Everybody here complains about having an empty and non fulfilling lives and now someone is trying to do something positive about it. This sounds like a great idea. Request sent. ","everybody fulfil positive","['everybody', 'fulfil', 'positive']","3"
"102415","comment","d58ewr9","2016-07-12 01:41:57","2016","You probably would have been better of trying to start ""intellectual"" (whatever that means) conversations here and then noting the people who answered in a way you found sufficiently intellectually.  ","intellectual conversation note","['intellectual', 'conversation', 'note']","3"
"102417","comment","d57tkon","2016-07-11 17:27:55","2016","you are one extremely cringy man, I'll give you that. ","cringy","['cringy']","1"
"102421","comment","d57of8s","2016-07-11 13:27:30","2016","Hahaha. I think I know that guy.","hahaha","['hahaha']","1"
"102426","comment","d5811ip","2016-07-11 20:33:54","2016","Aren't you one extremely nice person? ","","[]","0"
"102430","comment","d57mm8v","2016-07-11 11:42:56","2016","Intellectuals meet with other intellectuals. ","intellectual meet intellectual","['intellectual', 'meet', 'intellectual']","3"
"102433","comment","d5bvt0b","2016-07-14 17:07:31","2016","Haha. It's the tall girl who jumps in all your songs BTW ","tall jump song","['tall', 'jump', 'song']","3"
"102434","comment","d5b3d41","2016-07-14 00:54:25","2016","With the heat I've got for only 1 post, I think I'll keep it to myself dude haha. People are too busy catching Pokemons in mosques. ","heat busy catch pokemon mosque","['heat', 'busy', 'catch', 'pokemon', 'mosque']","5"
"102436","comment","d58wa34","2016-07-12 09:59:17","2016","Ok, I love you as much as I love the smell of shawrama.. true love right here young lady with mustache, I wouldn't let it go if I was you.","smell young lady","['smell', 'young', 'lady']","3"
"102439","comment","d5902rm","2016-07-12 13:16:01","2016","1- You make it sound as if I should be ashamed of my relation with my laundry delivery guy / secret lover Abdul.

2- You ungrateful bish.. you forgot when I picked up at 8 pm and showed you my knafeh collection.. and we had like a super hot cheese melting knafeh session !!  ","ashamed relation laundry delivery secret lover ungrateful pick collection super hot cheese melt session","['ashamed', 'relation', 'laundry', 'delivery', 'secret', 'lover', 'ungrateful', 'pick', 'collection', 'super', 'hot', 'cheese', 'melt', 'session']","14"
"102875","comment","fe8suo5","2020-01-13 19:45:39","2020","Yes, if you have the DCAA License, its all you need as it shows the drone serial number on the card with your details.

 And yes the expiry is also printed there, its one year.","license drone serial card expiry print","['license', 'drone', 'serial', 'card', 'expiry', 'print']","6"
"103211","comment","e5mg9iz","2018-09-08 22:43:31","2018","I've looked into it but I couldn't find any in my price range <40k","price range","['price', 'range']","2"
"103222","comment","e5ndt0l","2018-09-09 08:18:40","2018","Technically, still a word and a number.","technically","['technically']","1"
"103574","comment","c5c2v3q","2012-07-10 22:36:50","2012","Surprise!  Happy birthday!  

Ah man, *another* exotic car?

Maybe they should've just stuck with [a birthday sweet treat](http://www.youtube.com/watch?v=JnqUws0LWNc).  ","surprise birthday exotic birthday sweet treat","['surprise', 'birthday', 'exotic', 'birthday', 'sweet', 'treat']","6"
"103575","comment","c5cc9sz","2012-07-11 08:48:34","2012","I looked at the AD and it seems more like a sales gimmick for this company. It provided a link back to their website as well as their youtube page. Pardon the pun but I don't buy it.","sale gimmick website youtube pardon pun buy","['sale', 'gimmick', 'website', 'youtube', 'pardon', 'pun', 'buy']","7"
"103576","comment","c5cdavh","2012-07-11 10:15:52","2012","It's a marketing post. But isn't it against dubizzle rules to NOT put links or emails in the description?","marketing dubizzle rule email description","['marketing', 'dubizzle', 'rule', 'email', 'description']","5"
"103713","comment","dpf77h8","2017-11-06 16:35:33","2017","aah alright thanks for the tip. It's been kinda all over the place the past two weeks whenever I've used the metro.  I guess I gotta find some other way to get to DIC from burjuman for theorning classes at 8:30 atleast until these issues are not being reported anymore. ","tip past metro burjuman class atleast","['tip', 'past', 'metro', 'burjuman', 'class', 'atleast']","6"
"103840","comment","g7rzrrn","2020-10-05 15:25:20","2020","It's not well deserved. Even if you're a douchebag, 1000dh is a lot of money. I am all for police doing its job properly and fining douchebags on the road, but it has to be a reasonable fine. 1000dh is plain extortion.","douchebag police properly fine douchebag road reasonable fine plain","['douchebag', 'police', 'properly', 'fine', 'douchebag', 'road', 'reasonable', 'fine', 'plain']","9"
"104197","comment","jitpuab","2023-05-04 17:00:54","2023","If a vegan asked you to not keep milk in the fridge what would you do ?","vegan milk fridge","['vegan', 'milk', 'fridge']","3"
"104282","comment","jk0t7pt","2023-05-13 21:41:00","2023","No he started eating fish after I told him to speak to his clerk","eat fish clerk","['eat', 'fish', 'clerk']","3"
"104724","comment","dht935s","2017-05-20 19:43:22","2017","Not sure if it is tue, but this video has been making the rounds with the claim that all for free for one hour in Lulu Hypermarket.","round claim lulu hypermarket","['round', 'claim', 'lulu', 'hypermarket']","4"
"104947","comment","i7a5315","2022-05-04 15:56:51","2022","If I smoked I wouldn’t give this a second glance. In fact, I’d make it a challenge to smoke enough to fit each one in every hole…","smoke glance challenge smoke fit hole","['smoke', 'glance', 'challenge', 'smoke', 'fit', 'hole']","6"
"105078","comment","j5v1ul2","2023-01-25 23:38:11","2023","Did you make this?!?  


Oh man, from one web developer to another, I am proud of you and I will definitely add this to the list! Thank you for sharing!!","web developer proud","['web', 'developer', 'proud']","3"
"105210","comment","fkx1qyt","2020-03-19 14:57:49","2020","COVID19 treatment is free of cost even with no insurance at all. Know your rights!","treatment cost insurance","['treatment', 'cost', 'insurance']","3"
"105215","comment","cmr383f","2014-12-11 00:18:53","2014","The highest I have ever been in the UAE was at the Burj Khalifa on the viewing deck.","burj khalifa deck","['burj', 'khalifa', 'deck']","3"
"105216","comment","cmrnecx","2014-12-11 12:13:33","2014","Nice try Dubai Police :p","police","['police']","1"
"105221","comment","cmr09z7","2014-12-10 22:54:51","2014","Lots of drugs available here. The most popular is Panadol, followed by Flutab & Advil. You can buy them from guys wearing white lab coats.","drug popular panadol buy lab coat","['drug', 'popular', 'panadol', 'buy', 'lab', 'coat']","6"
"105226","comment","cmr37pr","2014-12-11 00:18:36","2014","Met a friend today. We went to a Shisha place in Karama. He had a joint with him that he smoked in the bathroom. There weren't too many people around so nobody noticed but the floor we were in was smelling strongly of weed after that.

I was terrified we'd get busted but all the manager did was shoot a disapproving look and tell him not to smoke in the bathroom when he returned to the table.","meet shisha karama joint smoke bathroom floor smell strongly weed terrified bust manager shoot smoke bathroom table","['meet', 'shisha', 'karama', 'joint', 'smoke', 'bathroom', 'floor', 'smell', 'strongly', 'weed', 'terrified', 'bust', 'manager', 'shoot', 'smoke', 'bathroom', 'table']","17"
"105229","comment","cmrdlip","2014-12-11 05:32:38","2014","Panadol night man! thats where its at","panadol night","['panadol', 'night']","2"
"105231","comment","cmr0zwp","2014-12-10 23:15:28","2014","Stay away online and offline is what I'd say. ","offline","['offline']","1"
"105237","comment","cmrmtvd","2014-12-11 11:35:21","2014","Panadol Cough & Cold - try it. 2 tablets at 6 pm, and then 2 at 8 pm. Enjoy.","panadol cough cold tablet","['panadol', 'cough', 'cold', 'tablet']","4"
"105240","comment","cmrntih","2014-12-11 12:44:59","2014","RIP Actifed Cough syrup 2014-2014","rip cough syrup","['rip', 'cough', 'syrup']","3"
"105241","comment","cmsc909","2014-12-12 04:27:04","2014","Believe me I know the difference between both xD ","","[]","0"
"105351","comment","ijaific","2022-08-07 13:16:51","2022","Idk, I recently got a haircut for 5 dirhams and it was just a normal cut lol. A lot of this whack stuff is down to the customer too. They won't set u on fire without consent lol","haircut dirham whack customer fire consent","['haircut', 'dirham', 'whack', 'customer', 'fire', 'consent']","6"
"106005","comment","ind40se","2022-09-07 00:56:01","2022","I'm cool enough to have a stalker fan. (Okinamii)","cool stalker fan","['cool', 'stalker', 'fan']","3"
"106070","comment","gkabzjh","2021-01-23 07:13:42","2021","Dont forget the spelling mistakes.","spelling","['spelling']","1"
"106217","comment","gbl0bx4","2020-11-08 12:45:02","2020","**Hello.**

I noticed you dropped 28 f-bombs in this comment. This might be necessary, but using nicer language makes the whole world a better place.

Maybe you need to blow off some steam - in which case, go get a drink of water and come back later. This is just the internet and sometimes it can be helpful to cool down for a second.

***

^I ^am ^a ^bot. ^❤❤❤ ^| **--> ^[SEPTEMBER](https://redd.it/ipsjip) ^[UPDATE](https://redd.it/ipsjip) <--**","bomb necessary language blow steam drink water internet cool september","['bomb', 'necessary', 'language', 'blow', 'steam', 'drink', 'water', 'internet', 'cool', 'september']","10"
"106285","comment","dl3havp","2017-08-03 08:44:11","2017","I use ""esteemed organization"" in my letters and I find it very polite :P P.S: I am not Indian :D ","organization letter polite indian","['organization', 'letter', 'polite', 'indian']","4"
"106290","comment","dl3fgjd","2017-08-03 07:54:15","2017","cant help but cringe thing about it","cringe","['cringe']","1"
"106310","comment","jkn0q52","2023-05-18 18:28:58","2023","One of my partners bought real estate in Dubai paying in USDT.","partner buy real estate","['partner', 'buy', 'real', 'estate']","4"
"106335","comment","el9nizw","2019-04-19 18:16:58","2019","They were the first with the cockroach toppings in dubai","cockroach","['cockroach']","1"
"106393","comment","j9fjfv3","2023-02-21 19:42:23","2023","Yeah, you have to keep using your old number by phone and update your EID. You’ll lose it otherwise.","eid","['eid']","1"
"106643","comment","extkyec","2019-08-23 18:29:37","2019","No brazzer. No bezzat for badrol","","[]","0"
"106911","comment","ijmm8vg","2022-08-10 00:28:36","2022","How true man

My friend who is growing long hair hasn't seen a barber for almost a year.","hair barber","['hair', 'barber']","2"
