"index","text_type","ID","date_created","year","long_text","clean_text","tokens","word_count"
"61115","comment","dqs7fzw","2017-12-05 07:11:24","2017","Second this. Health care here is very similar to the US in terms of insurance.
If you're willing to get a premium package, then you might end up with very few extra costs. However, most packages for employees don't nearly cover everything.

So unless you're willing to increase your monthly premium, you'll end up paying out of pocket. ","health term insurance premium package cost package employee nearly monthly premium pocket","['health', 'term', 'insurance', 'premium', 'package', 'cost', 'package', 'employee', 'nearly', 'monthly', 'premium', 'pocket']","12"
"61118","comment","dqsa8vh","2017-12-05 08:03:13","2017","Some of the healthcare is comparable. Most of the nurses outside of the ""western"" hospitals shouldn't even be in a patients room. ","healthcare comparable nurse outside western hospital patient room","['healthcare', 'comparable', 'nurse', 'outside', 'western', 'hospital', 'patient', 'room']","8"
"61161","comment","ej3ittu","2019-03-22 08:58:55","2019","Yeah man.. really. And thanks for posting this, made my morning 😁","morning","['morning']","1"
"61663","comment","franish","2020-05-21 04:56:45","2020","You probably wouldn't know what kind of service ""CDC"" or ""MHG"" or ""DFHNSDFKN"" provide either, unless you spend 30 seconds reading their website. Point is, you might not know what kind of services any department/institution provides without a Tad-bit of research, regardless of the name.","service cdc spend website service department institution tad research","['service', 'cdc', 'spend', 'website', 'service', 'department', 'institution', 'tad', 'research']","9"
"62003","comment","f0qx1io","2019-09-19 08:47:00","2019","lol I have this shirt, for working out, etc.

Never thought that just by going out, I can go back home immediately lol.","shirt immediately","['shirt', 'immediately']","2"
"62050","comment","f0sqibw","2019-09-19 20:03:50","2019","I understand now because of your comment! Thanks.","","[]","0"
"62062","comment","f0rm5yc","2019-09-19 14:01:37","2019","https://montrealnewspaperguild.files.wordpress.com/2018/06/im-offended.jpg

We SERIOUSLY need some thicker skin. I'm not saying verbal bullying isn't a thing, but our generation is so soft it's stomach turning.","offend thick skin verbal bullying generation soft stomach turn","['offend', 'thick', 'skin', 'verbal', 'bullying', 'generation', 'soft', 'stomach', 'turn']","9"
"62384","comment","gvk4opr","2021-04-23 16:27:34","2021","OMGGG!!! She is just adorbs! Thanks so much! ❤️","","[]","0"
"62489","comment","cttly27","2015-08-06 18:58:23","2015","Its as simple as this- lock your f**king door.
Even if you reported it to the cops the first thing they would say is this.","lock king door cop","['lock', 'king', 'door', 'cop']","4"
"62490","comment","cttnt0n","2015-08-06 19:44:39","2015","A girlfriend AND ""random working girls""?

Maybe it was their pimp sending you a subtle reminder. You mistreat any recently, or stiff someone lately?","girlfriend pimp subtle reminder mistreat","['girlfriend', 'pimp', 'subtle', 'reminder', 'mistreat']","5"
"62491","comment","cttkuko","2015-08-06 18:28:31","2015","I have a small tid bit it might sound a bit strange but I'll say it any way... Try locking your doors?

Was the stuff sprawled out as if it would be returned to how it was originally? Was the back exit/windows unlocked... Stupid question, of course they were.","strange lock door originally exit window unlock","['strange', 'lock', 'door', 'originally', 'exit', 'window', 'unlock']","7"
"62493","comment","cttq4cm","2015-08-06 20:40:02","2015","Any ex-gfs that may want to come round snooping?","round","['round']","1"
"62494","comment","ctty0qr","2015-08-06 23:39:33","2015","Here's a theory... Your shopping bags were switched. You accidentally got a bag of mysterious white powder instead of what you were buying. Someone broke in, found it, and switched it back.","theory shopping bag switch accidentally bag mysterious powder buy switch","['theory', 'shopping', 'bag', 'switch', 'accidentally', 'bag', 'mysterious', 'powder', 'buy', 'switch']","10"
"62495","comment","cttubcp","2015-08-06 22:14:15","2015","lock your door; it is as simple as that.  common sense 101.","lock door common","['lock', 'door', 'common']","3"
"62496","comment","ctugpc2","2015-08-07 08:22:55","2015","Tip #1..don't take hookers to your home, that's an invitation for theft
Tip #2. Lock you door, Dubai is safe but not that safe
Tip #3. Get a liquor license if your concerned about a having alcohol at home","tip hooker invitation theft tip lock door safe safe tip liquor license concerned alcohol","['tip', 'hooker', 'invitation', 'theft', 'tip', 'lock', 'door', 'safe', 'safe', 'tip', 'liquor', 'license', 'concerned', 'alcohol']","14"
"62499","comment","cttskph","2015-08-06 21:36:20","2015","Chinese water torture method.

So far it seems to be working, no?","chinese water torture method","['chinese', 'water', 'torture', 'method']","4"
"62522","comment","dme9juh","2017-09-01 01:17:46","2017","My cafeteria picks up my phone on the second ring and goes ""Hello, flat #, *proceeds to recite my order to me*"". All I have to do is say okay. 

I have to call them up and tell them before I leave town. Otherwise they think I'm dead. Or worse: *dieting*. ","cafeteria pick ring flat proceed recite order town dead","['cafeteria', 'pick', 'ring', 'flat', 'proceed', 'recite', 'order', 'town', 'dead']","9"
"62535","comment","dme5kvg","2017-09-01 00:07:22","2017","You're on reddit you know that right?","","[]","0"
"62538","comment","dme0vhq","2017-08-31 22:46:54","2017","You want to make a list accusing multiple businesses of something they have no come back on? You want to do that in a country with some of the strongest defamation laws in the world?","accuse defamation law","['accuse', 'defamation', 'law']","3"
"62726","comment","ga54r5d","2020-10-26 09:41:36","2020","Thanks buddy, stay tuned for my next video with the new gear!","gear","['gear']","1"
"62849","comment","iplijyg","2022-09-23 17:58:25","2022","No he doesn't, apparently u don't know Hattem","apparently","['apparently']","1"
"62893","comment","ipmrnqa","2022-09-23 23:35:26","2022","Daaamn. Nice rebuttal","","[]","0"
"62997","comment","g9wi824","2020-10-24 16:43:19","2020","While at it, put numbers per item on the menu like in Chinese restaurants so it’s not subject to spelling / misinterpretation","item menu chinese restaurant subject spelling","['item', 'menu', 'chinese', 'restaurant', 'subject', 'spelling']","6"
"63009","comment","g9whl4g","2020-10-24 16:38:30","2020","This is a very common thing in big Indian cities since years now. There are several delivery only restaurants and it's not like they only serve cheap food. There are delivery only outlets that serve items like gourmet burgers, top notch pizza and pasta, etc. I know it's not easy to change quickly but most restaurants in the middle east are very slow to adapt to change. In fact, it is much easier for a new delivery only outlet to break even compared to a new full service restaurant.","common indian delivery restaurant serve cheap food delivery outlet serve item gourmet burger notch pizza pasta quickly restaurant middle east adapt delivery outlet service restaurant","['common', 'indian', 'delivery', 'restaurant', 'serve', 'cheap', 'food', 'delivery', 'outlet', 'serve', 'item', 'gourmet', 'burger', 'notch', 'pizza', 'pasta', 'quickly', 'restaurant', 'middle', 'east', 'adapt', 'delivery', 'outlet', 'service', 'restaurant']","25"
"63094","comment","g9x5fba","2020-10-24 19:36:34","2020","many people don't like ""jack of all the trades"" type of restaurants ...

in fact, in developed countries the trend is more towards ultra-specialized restaurants like Ramen eateries, places that do only fries, ...","jack trade restaurant develop trend ultra specialized restaurant raman fry","['jack', 'trade', 'restaurant', 'develop', 'trend', 'ultra', 'specialized', 'restaurant', 'raman', 'fry']","10"
"63325","comment","fs2r3zz","2020-05-28 14:45:18","2020","Okay wailing man baby. 

Not getting your way hurting you ego ?","baby hurt ego","['baby', 'hurt', 'ego']","3"
"63403","comment","fseq9eu","2020-05-31 13:43:33","2020","We’re these from orange godowns near building 4?","orange building","['orange', 'building']","2"
"63843","comment","itb74hi","2022-10-22 12:41:45","2022","She was waving her hands around and pointing.That isn't a way to celebrate infront of everybody.Idg what you don't u derstand about that.It would have been the same if it was a guy.","wave celebrate infront everybody","['wave', 'celebrate', 'infront', 'everybody']","4"
"63846","comment","itba4nr","2022-10-22 13:25:57","2022",">The very fact that you are defending his actions shows how little you understand about etiquette.

Who sets etiquette? The West?","defend etiquette etiquette west","['defend', 'etiquette', 'etiquette', 'west']","4"
"63894","comment","itb9jsy","2022-10-22 13:17:31","2022","It’s cute how you keep making it seem like I’m attacking Emiratis when in reality I’m just here poking holes at your flawed logic. Nice ad hominem.","cute attack emiratis poke hole flawed logic","['cute', 'attack', 'emiratis', 'poke', 'hole', 'flawed', 'logic']","7"
"63930","comment","jk3jwpl","2023-05-14 13:14:59","2023","Nah, Dubai is the country. Rest doesn't exist.","nah rest","['nah', 'rest']","2"
"64031","comment","jo8pv59","2023-06-15 20:16:56","2023","My nationality is irrelevant to my comment.","nationality irrelevant","['nationality', 'irrelevant']","2"
"64058","comment","hxah86c","2022-02-17 14:05:10","2022","don't forget the:

my landlord is increasing my rent","landlord rent","['landlord', 'rent']","2"
"64272","comment","gcqggke","2020-11-18 20:58:59","2020","I'm ootl :(

Edit: found it https://youtu.be/p-3e0EkvIEM nice lol","","[]","0"
"64584","comment","gzfcifo","2021-05-25 23:15:16","2021","IF it's hard to differentiate, it's probably a marketing stunt.","differentiate marketing stunt","['differentiate', 'marketing', 'stunt']","3"
"64689","comment","j2rvi3r","2023-01-03 18:58:53","2023","![gif](giphy|AUlNi9YCtzSnu|downsized)","giphy downsize","['giphy', 'downsize']","2"
"64875","comment","ionk8z0","2022-09-16 15:56:12","2022","Why would anyone mention that particular clause in the contract? My job as a health care professional requires team meetings to discuss progress related to our cases.","particular clause contract health professional team meeting discuss progress","['particular', 'clause', 'contract', 'health', 'professional', 'team', 'meeting', 'discuss', 'progress']","9"
"65236","comment","gnmzwxt","2021-02-16 16:05:31","2021","Thats really helpful. And yes, race is definitely a factor, no point denying it. I never considered starting my own centre so soon as I'm just about entering the field but your points make sense. Is tele/video counseling big there?","race factor deny centre field","['race', 'factor', 'deny', 'centre', 'field']","5"
"65271","comment","czxeexw","2016-02-12 20:02:28","2016","Love it. Kinda struck me as zues throwing a thunderbolt.

Anyways they would have gotten Dubais concent to use it like that. Like they did in that video game.","strike anyways dubais game","['strike', 'anyways', 'dubais', 'game']","4"
"65278","comment","czx8863","2016-02-12 16:47:59","2016","Scene will probably be cut and replaced with the Burj being imbenetrable","scene replace burj","['scene', 'replace', 'burj']","3"
"65279","comment","czxsptx","2016-02-13 01:38:18","2016","With a slogan saying ""come at me Bro""
","slogan","['slogan']","1"
"65308","comment","ezt6rci","2019-09-10 17:40:31","2019","Let’s start with some real intelligence...","real intelligence","['real', 'intelligence']","2"
"65322","comment","fr1ttfj","2020-05-18 22:17:12","2020","So what point are you trying to argue here? That a little bit of racism or bigotry is okay? Who are you to determine what’s considered insignificant and what’s worthy of being fired or imprisoned etc?

What I’m saying, is that the coverage as of late has been EXTREMELY one sided towards Indians, and not that those who have been caught out don’t deserve it, but I just think it’s strange that the punishments aren’t being dolled out across the board.","argue racism bigotry determine insignificant worthy fire imprison coverage late indians catch strange punishment board","['argue', 'racism', 'bigotry', 'determine', 'insignificant', 'worthy', 'fire', 'imprison', 'coverage', 'late', 'indians', 'catch', 'strange', 'punishment', 'board']","15"
"65375","comment","dln5y4x","2017-08-15 10:35:39","2017","Some guy (who is now banned and whose posts were removed) voiced anti-islamic thoughts and feelings.  The OP is angry that the post was up for a few hours before a mod got on to remove it.  
  ","ban voice anti islamic feeling angry","['ban', 'voice', 'anti', 'islamic', 'feeling', 'angry']","6"
"65387","comment","dlnjedz","2017-08-15 18:20:11","2017","It was pretty clearly a veiled threat of ""I don't like how things are going on here... boy it would sure be a shame if someone (not saying who but someone) reported this all to the authorities... so why don't you do as I say"" with extra Arabic thrown in to try and prove s/he has local clout to complain to the cops if s/he wants.","veil threat boy shame authority arabic local clout cop","['veil', 'threat', 'boy', 'shame', 'authority', 'arabic', 'local', 'clout', 'cop']","9"
"65390","comment","dln6v56","2017-08-15 11:11:35","2017","How would you know if someone is on location or not, since that apparently matters? 

I consider myself law-abiding, I don't have a family to feed and my company provides solutions that allow this country to grow - from expo 2020 to dealing with air traffic and building a modern military force, to quote a few examples. Expats may enjoy a certain lifestyle but they also give in return, don't forget that.","location apparently law abide family feed solution expo deal air traffic build modern military force quote expat lifestyle","['location', 'apparently', 'law', 'abide', 'family', 'feed', 'solution', 'expo', 'deal', 'air', 'traffic', 'build', 'modern', 'military', 'force', 'quote', 'expat', 'lifestyle']","18"
"65408","comment","dlnhrh4","2017-08-15 17:46:15","2017","It's actually very typical of people of his ilk. ","typical","['typical']","1"
"65718","comment","ijkyeag","2022-08-09 18:10:48","2022","Weren't the employees not getting paid?","employee","['employee']","1"
"65961","comment","jfoij0v","2023-04-10 14:45:26","2023","I don’t really agree. The X25 is great if you need metro access (my school happened to be in Oud Metha) and the 50 gives you direct access to Dubai Mall","metro school oud metha direct mall","['metro', 'school', 'oud', 'metha', 'direct', 'mall']","6"
"66301","comment","jg75chj","2023-04-14 10:36:45","2023","Holy shit. Didn't know she had a big fanbase as well","holy","['holy']","1"
"66790","comment","dnstajv","2017-10-02 18:00:25","2017","I usually send a removal comment when I delete something for what it's worth.

Edit: I just noticed

> You can't just keep deleting everything that you don't agree with

 I'm so sorry we deleted your shity post simply titled KRIS FADE linking to a youtube ad, fuck off

https://www.reddit.com/r/dubai/comments/73revl/kris_fade/","delete delete delete title kris fade youtube","['delete', 'delete', 'delete', 'title', 'kris', 'fade', 'youtube']","7"
"66795","comment","dnsv6mu","2017-10-02 18:38:57","2017","LOL :D who are you to decide what is a shit post or not? As long as it's not advertising something or breaking the rules don't delete it just because you disagree are you trying to be part of the dictatorship here? 

Let people post what they feel like and let it get downvoted for shit, downvotes made me strive harder to make better posts :) ","advertise rule delete disagree dictatorship strive","['advertise', 'rule', 'delete', 'disagree', 'dictatorship', 'strive']","6"
"66801","comment","dnt3nna","2017-10-02 21:11:49","2017","New phone who dis","","[]","0"
"66806","comment","dnuc17t","2017-10-03 15:28:08","2017","I am currently the main poster in /r/UAE but the former mod abandoned the sub so it needs content to have a hope of staying active. 

Every country in the world has a sub, so it would be strange if UAE did not have one. /r/dubai has been filling that role recently but ultimately it makes more sense to keep each emirate's sub about that emirate, with /r/UAE for country-wide matters.","poster active strange role ultimately wide","['poster', 'active', 'strange', 'role', 'ultimately', 'wide']","6"
"66879","comment","h71tmwv","2021-07-30 09:23:04","2021","Really? Which school bruh?

Tbh my school ensured I didn't have a good final payment experience so I can understand.","school bruh school ensure final payment","['school', 'bruh', 'school', 'ensure', 'final', 'payment']","6"
"66949","comment","jhmeiir","2023-04-25 10:23:12","2023","Yup. Soulless place with one dimensional dating pool. So glad I don't have to date anymore.","yup soulless date pool date","['yup', 'soulless', 'date', 'pool', 'date']","5"
"66960","comment","jhmgzvw","2023-04-25 10:56:48","2023","Sorry but if you have to convince someone it is going to be fun. You do sound desperate.","convince fun desperate","['convince', 'fun', 'desperate']","3"
"66984","comment","jhorc6y","2023-04-25 22:50:47","2023","Women go on dates for free food? That’s new to me lol .  Going on a date I can barely eat anything because I m usually so excited 😅which kinda takes away my hunger . It’s mostly about spending time and getting to know each other . If you are meeting people through dating apps , then it’s best to filter them out. Yes the process maybe slow and can lead to you being impatient, but that’s the best way to avoid such gold diggers. Tbh I tried offering to split the bill but the guy always insists and says “ next time you can pay “ lol but yeah it’s best to go for coffee or tea , I guess Tim Hortons is quite reasonable

And the dating struggle is real for both the gender here in dubai . This is a transit location and no one is here for too long , if you are up for casuals then it’s easy but finding someone for the long run can be challenging. Meeting people organically is usually through work / school or uni .. I don’t think the Meetup and networking groups should be the place to hunt for people to date as you are there for other professional purposes. It can be better and easier for extroverts tho.","date food date barely eat excited hunger spending meet date filter process impatient digger offer split bill insist coffee tea reasonable date struggle real gender transit location casual challenge meeting organically school uni meetup networking hunt date professional purpose","['date', 'food', 'date', 'barely', 'eat', 'excited', 'hunger', 'spending', 'meet', 'date', 'filter', 'process', 'impatient', 'digger', 'offer', 'split', 'bill', 'insist', 'coffee', 'tea', 'reasonable', 'date', 'struggle', 'real', 'gender', 'transit', 'location', 'casual', 'challenge', 'meeting', 'organically', 'school', 'uni', 'meetup', 'networking', 'hunt', 'date', 'professional', 'purpose']","39"
"67075","comment","jhmsoy7","2023-04-25 13:48:54","2023","Pretty much common. I know at least 3 girls who got pregnant and had to dump their kid to their parents. Boyfriend is totally out of the scene.","common pregnant dump parent boyfriend scene","['common', 'pregnant', 'dump', 'parent', 'boyfriend', 'scene']","6"
"67264","comment","ggwk3mc","2020-12-24 19:21:38","2020","Today's youth is already over-stimulated from a young age with the hypersexualization in the media. They can't even play or ride a bike outside in this city (outside of a gated community, that is) without picking up these cards out of pure innocent curiosity.  There's seriously been an exponential spike in these cards and looks like nothing's being done about it 😕","youth young age play ride bike outside outside gate community pick card pure innocent curiosity spike card","['youth', 'young', 'age', 'play', 'ride', 'bike', 'outside', 'outside', 'gate', 'community', 'pick', 'card', 'pure', 'innocent', 'curiosity', 'spike', 'card']","17"
"67332","comment","gh1yt4a","2020-12-26 10:42:51","2020","yes, but the cards were not littered on the streets like they are now. You had the occasional cards yes, but to this degree where the pavements are full of them, no way. 

Im in Marina 8 years now, and this only started about 1.5 years ago.","card litter street occasional card degree pavement marina","['card', 'litter', 'street', 'occasional', 'card', 'degree', 'pavement', 'marina']","8"
"67481","comment","jia8ewx","2023-04-30 12:35:44","2023","All what you're saying is right. I am also interested to see an expert take into your question, and hate it when idiots want to chime in with their stupid one line replies (Dubai model, only Dubai, that's the answer, bla bla)","expert chime line model bla bla","['expert', 'chime', 'line', 'model', 'bla', 'bla']","6"
"67503","comment","joomu21","2023-06-19 13:09:22","2023","Ah also i remember one time I went to the supermarket and at the entrance, when I got a basket, there was a samsung galaxy phone in the basket underneath the one I got so immediately took it and brought it to the security. And one time, I went to a dream theater concert in sports city. On the way out, I found an apple watch on the ground, again, I gave it to the security guard. I really hope those people got their stuff back.","supermarket entrance basket samsung galaxy basket underneath immediately security dream theater concert sport apple ground security guard","['supermarket', 'entrance', 'basket', 'samsung', 'galaxy', 'basket', 'underneath', 'immediately', 'security', 'dream', 'theater', 'concert', 'sport', 'apple', 'ground', 'security', 'guard']","17"
"67571","comment","i9cgtqb","2022-05-20 20:19:00","2022","Ok thanks. Will wait for talabat and in the meantime try eateasy.","talabat meantime","['talabat', 'meantime']","2"
"68126","comment","h5axqpx","2021-07-15 22:16:57","2021","When I park hummers I can’t really do much bout it lol","park bout","['park', 'bout']","2"
"68201","comment","joy7sef","2023-06-21 15:51:06","2023","What kind of salon? Can recommend Arfi I’m Barsha and Nails Lab in JLT for Russian Manicures","salon barsha nail lab jlt russian","['salon', 'barsha', 'nail', 'lab', 'jlt', 'russian']","6"
"68270","comment","ge8yt82","2020-12-01 15:01:34","2020","Is it included in the visa? I was looking specifically for covid cover","visa specifically covid","['visa', 'specifically', 'covid']","3"
"68347","comment","h3ni61m","2021-07-01 09:50:33","2021","Time to get the credit/debit card cancelled.","credit debit card cancel","['credit', 'debit', 'card', 'cancel']","4"
"68857","comment","e3yo68f","2018-08-10 21:54:08","2018","Sweden has a 90 day visa on arrival. So she probably used up the 90 days and didn't apply for a visa before going.","sweden visa arrival apply visa","['sweden', 'visa', 'arrival', 'apply', 'visa']","5"
"69232","comment","fp72kog","2020-05-01 23:54:51","2020",">Strangely enough 2020 started to be better.

This post is brought to you by the Novel Coronavirus.","strangely novel coronavirus","['strangely', 'novel', 'coronavirus']","3"
"69716","comment","jmcz3p3","2023-05-31 20:53:56","2023","Had a friend who lost 1.2k on a KFC scam. Bottom line don’t look for cheap deals.","kfc scam line cheap deal","['kfc', 'scam', 'line', 'cheap', 'deal']","5"
"69820","comment","gi5x0io","2021-01-05 13:06:36","2021","Should’ve asked for a million bucks instead","million buck","['million', 'buck']","2"
"69998","comment","jbp3pt1","2023-03-10 21:17:33","2023","What horror stories did you hear about AUS?

Did you ever consider Texas A&M, Cornell, etc in Doha?","horror aus texas doha","['horror', 'aus', 'texas', 'doha']","4"
"70113","comment","j97cybd","2023-02-20 00:36:51","2023","Maybe he’s trying to find an expert where he lives to come to his place. It’s common in islam to do so.","expert common islam","['expert', 'common', 'islam']","3"
"70130","comment","ckccdte","2014-09-08 13:54:21","2014","I actually think this article gives a much fairer view than previous ones. It addresses the fact that the UAE is not the worst, but there are still issues to be addressed.

The worst players in all of this are the ""recruiters"" in South Asia. They are utter parasites who lie and steal from the workers, promising highly-paid employment in return for a few grand. ","fair address address player recruiter south asia utter steal worker promise highly employment grand","['fair', 'address', 'address', 'player', 'recruiter', 'south', 'asia', 'utter', 'steal', 'worker', 'promise', 'highly', 'employment', 'grand']","14"
